{
  "title": "Restricting SSH Access from the Internet",
  "before": {
    "nodes": [
      {
        "id": "internet",
        "type": "internet",
        "label": "Public Internet",
        "icon": "globe"
      },
      {
        "id": "nsg",
        "type": "control",
        "label": "NSG Rule",
        "icon": "firewall"
      },
      {
        "id": "vm",
        "type": "resource",
        "label": "Target VM",
        "icon": "server"
      }
    ],
    "edges": [
      {
        "from": "internet",
        "to": "nsg",
        "label": "TCP 22 (SSH)"
      },
      {
        "from": "nsg",
        "to": "vm",
        "label": "Inbound SSH Allowed"
      }
    ],
    "risk_callout": "Unrestricted SSH port allows internet-wide brute force attacks and unauthorized access."
  },
  "after": {
    "nodes": [
      {
        "id": "internet",
        "type": "internet",
        "label": "Public Internet",
        "icon": "globe"
      },
      {
        "id": "internal",
        "type": "user",
        "label": "Internal Subnet",
        "icon": "network"
      },
      {
        "id": "nsg",
        "type": "control",
        "label": "NSG Rule",
        "icon": "firewall"
      },
      {
        "id": "vm",
        "type": "resource",
        "label": "Target VM",
        "icon": "server"
      }
    ],
    "edges": [
      {
        "from": "internet",
        "to": "nsg",
        "label": "TCP 22 (SSH)",
        "blocked": true
      },
      {
        "from": "internal",
        "to": "nsg",
        "label": "TCP 22 (SSH)"
      },
      {
        "from": "nsg",
        "to": "vm",
        "label": "Inbound SSH Allowed"
      }
    ],
    "control_callout": "Restricting SSH inbound traffic to internal CIDR blocks internet-based attacks."
  },
  "code_diff": [
    "- source_address_prefix = \"*\"",
    "+ source_address_prefix = \"10.0.0.0/24\""
  ]
}
